{
  "version": "auraone-rubric-v1",
  "rubric_id": "tutorial",
  "label": "Synthetic Tutorial Rubric",
  "tie_break_rule": "prefer_lower_risk",
  "judge_prompt_contract": {
    "instruction": "Return JSON scores per criterion.",
    "output_format": "json",
    "required_fields": [
      "criterion_id",
      "score",
      "rationale"
    ]
  },
  "provenance": {
    "source": "synthetic tutorial",
    "created_by": "AuraOne",
    "created_at": "2026-05-11",
    "synthetic": true
  },
  "criteria": [
    {
      "criterion_id": "correctness",
      "label": "Correctness",
      "description": "Answer is factually supported by the prompt.",
      "scale_type": "binary",
      "weight": 0.5,
      "tie_break_rule": "prefer_lower_risk",
      "anchors": [
        {
          "value": 0,
          "label": "incorrect"
        },
        {
          "value": 1,
          "label": "correct"
        }
      ],
      "examples": [
        {
          "input": "synthetic",
          "score": 1
        }
      ]
    },
    {
      "criterion_id": "completeness",
      "label": "Completeness",
      "description": "Covers the required steps without adding unsupported claims.",
      "scale_type": "ordinal",
      "weight": 0.5,
      "anchors": [
        {
          "value": 1,
          "label": "missing"
        },
        {
          "value": 2,
          "label": "partial"
        },
        {
          "value": 3,
          "label": "complete"
        }
      ],
      "examples": [
        {
          "input": "synthetic",
          "score": 3
        }
      ]
    }
  ]
}
